Student,Response,Analysis,Explanation,Critique,Advance ClaimA 116,The local flooding of Charleston was not caused by the increase of precipitation like the local meteorologist claimed to be the reason for the flooding in the town of Charleston but by the increase of developed land area with impermeable surfaces. Looking at graph 1 that shows precipitation patterns in Charleston from 1963-2013 you can see that there has not been any increase in precipitation over the years. The local meteorologist said that the increase of precipitation did not become a problem until 2015 which is inaccurate because the graph shows that from the year 1963 to 2005 the precipitation decreased until 2015 to where it gets back up to where it was before the decrease. The flooding of Charleston is due to the increase of Developed-Impermeable areas because water cannot get through those surfaces so the water stays in certain areas instead of draining or evaporating because there is too much of it in one area. If there were more Developed-Permeable areas and more Natural areas and less Developed-Impermeable areas the town of Charleston would not being having flooding problems due to the fact that the water would not be getting trapped in areas because it has nowhere to flow. The water would be seeping through that earth and the water would be getting evaporated. The flooding of the town Charleston is in fact not caused by the increase of precipitation but by the increase of the town of Charleston increasing impermeable surfaces. ,3,4,3,4B 117,"The city of Charleston has been having flooding issues because people or the –workers” have developed-impermeable surfaces. Flooding has never been a problem for Charleston until 2005, but the floods have increased in frequency ever since.  Students are investigating this in a middle school science class.  They have collected data about the cityês precipitation over the last 50 years and the amount of land used for different purposes.  Measures of precipitation indicate how much rain and snow the city receives. The precipitation patterns from 1963 to 2013 have increased by a lot.  In 1963 precipitation was about 58 in. and for 2013 it was 60 in.  It has increased by a lot ever since.  Natural areas in Charleston have decreased from 1973 to 2013.  There have been more developed-impermeable surfaces since then that is why the city has been having so much flooding.  That city needs to have more permeable surfaces so that water can go through and not cause any flooding.  Permeable surfaces have increased to from 1973 to 2013, but just by a little bit.   They should tell some of the workers to start developing permeable surfaces in the places they can so they city wont get flooded.  The cause of Charleston flooding is the increased precipitation.  The annual precipitation data shows that rain and snowfall in the area have increased steadily since about 2005.  The city is going to keep on flooding if you keep on putting more sidewalks, buildings, and parking lots, the water has nowhere to go.  I think that they should stop building buildings and start putting more permeable surfaces.",3,2,0,0B 118,The Charleston flooding problem are due to the increases in developed land areas with impermeable surfaces. The meteorologist is wrong because the precipitation went down in 1963-1973. And in 1963-1973 the flooding went down a lot. I think the reason is that there is so many floods is because the natural areas. The are building buildings on impermeable surfaces that make the water flood. The city floods every time it rain because it heavily rain and they donêt have nothing to stop the rain it sounds like. The flooding has been around for 50 years or so. In 1963 to 1973 the flooding went down. Then 1983 it went up. but in 2013 the town of Charleston has seen there most floods of all time. The solution is to let the water go throw. And they need to stop building on impermeable surfaces cause that why it flood because the water has no where to go. they need to make something so the water will go in to a creek or something so the town will not get flood no more. if there stuff keeps flood maybe they should not build it there.,,,,B 119,"Charlestonês flooding problems are due to the increases in developed land areas with impermeable surfaces because the water has no way to get out, the water just builds. The Developed-impermeable surfaces are places or areas that people have created like building and pavement, and sidewalks that water canêt go through. So it just builds up. But then there is other areas called Developed-permeable areas that water can go through like fields and grassy areas. The local meteorologistês claim is inaccurate, he/she said that –The cause of Charlestonês flooding problem is the increased precipitation. The annual precipitation data shows, that rain and snowfall in the area increased steadily since 2005. Flooding did not become a problem for the city until 2005.Therefore, increased precipitation has led to local flooding.” I feel like he/or she is wrong because it would have to be the way they built things for it flood. The most have a lot of Developed- impermeable areas where water canêt go through. It has nothing to do with the precipitation it is just how they built things. It also says that it hasnêt been a problem since 2005,they already built the road, sidewalks, buildings. And then thatês when the flooding started to happen in 2005 and then it got worse as time went so I am thinking it has to be because of the Developed-impermeable areas the water has no where to go it sits then it builds up then you got a flood.",2,4,3,4B 120,"Since 2005 the land in and around Charleston has been flooding every time it rains heavily. The reason for this is Charlestonês flooding problems are due to the increases in developed land areas with impermeable surfaces. In 2013 in Charleston there where 45-Natural areas, 19- Developed-Permeable Surfaces, and 36- Developed-Impermeable  Surfaces. In 2003 the D-IS was 21, In ten years it was re counted and the D-IS was 36. The rain has also increased since 2005, but with the more D-IS the rain has less places to seep into the ground at, my conclusion is that the flooding problems have came from the more D-IS and the lack of drainage.",,,,B 121,"Charleston is having a flood problem and this just happened recently. Flooding in Charleston hasnêt been this bad since the mid 60s. Our graphs and collected data show that. In fact itês the worst it has ever been and, the people of Charleston need an answer, a correct answer.  With my evidence and data Iêve gathered, I will tell you why the flooding is not because of the rise in precipitation. Many of the citizens in Charleston are very confused about the situation and they need answers.  Most of the citizens have been living most of their lives and nothing has happened to them like this. These citizens of Charleston are afraid because flooding can be very dangerous and we want to help keep them and their families safe. In the year 2013, our data has shown that natural areas have decreased on the surfaces in Charleston.  For those who donêt know what natural areas are, they are areas that have not been developed by humans.  The Developed-Impermeable Surfaces are on a rise, more than it ever has been.  This means that when it rains in Charleston, there is no way for the water to pass through or around the area so it floods. In conclusion, we need to build ways for the water to pass through Charleston or, it will continue to flood and, it will only get worse.  The flooding is not due to increased precipitation, if it was then it probably wouldnêt be as serious as it is now.  I hope that by telling people this some will take in consideration to help make the people of Charleston to feel safe again.",,,,B 122,"The cause of Charleston flooding problem is the increased precipitation.  The annual precipitation data shows that rain a snowfall in the area have increased steadily since about 2005. Flooding did not become a problem for the city until 2005.  Therefore, increased precipitation has led to local flooding.  The increased rainfall count has made the flooding be twice as bad, and because of the population being so big, there is less places for people to run and take shelter too. If they were to make more of these developed permable surfaceês there would be less amount of damage that this city would have to clean. Natural areas such as soccer fields baseball fields and other areas such as football fields are more susceptible to flooding.",,,,B 123,"–Charlestonês flooding problems are due to the increases in developed land areas with impermeable surfaces, and tell why the local meteorologistês claim is inaccurate.” The claim is inaccurate, because you donêt put the question that you are trying to solve in the claim.  I believe that there is a problem with flooding, because of the precipitation going up ever since the year 2005.  So every time there is a heavy poor down of rain or snow it always makes it flood, because of how large the rain and snowfall is in Charlestonês town.  Another problem is that there is less land to cover because half of the land in Charlestonês is already covered so that makes there less land to cover. The meteorologistês argument says, –the the land is flooding, because there is to much rain and snowfall in Charlestonês town.”  I really do believe that this argument is true.  There is nowhere for the water to go so all it does is flood the land.  There is also a problem that there has been increases in the developed land area with impermeable surfaces.  Whenever you have too much impermeable surfaces then there is nowhere for the water to go so all it does is sits and floods. There is also a lot of floods, because the town has built three new schools and many homes to meet the needs of its growing population.  They have also put in new roads, more sidewalks, and more parking lots.  So that leaves nowhere for the water to drain out of the city. The reason why the town has so much floodingês is, because they keep on making the town bigger and bigger by building new things.",3,3,0,4B 124,"Charlestonês flooding problems are due to the increase in developed land areas with impermeable surfaces. A meteorologist has explained why he believes the flooding has occurred but he failed to mention the history of Charleston he also failed to mention and the impermeable surfaces he failed to mention so although he was partly right he was also wrong hereês why. In the argument that the meteorologist prepared he said that the flooding has been caused by the increase in precipitation that Charleston has received the rain has been on a steady incline since 2005 witch was when the flooding started, but what he failed to mention was in 1973 the precipitation was almost the same height as it was during the flooding.  The difference was the amount of impermeable surfaces that was in Charleston at the time there was not near as many in 1973 as there was during the flooding so although the rain was a factor in the flooding it was not the reason it occurred the rain would fall and have no wear to go because of all the impermeable surfaces witch in turn causes flooding .So although the meteorologist was partly correct he failed to look at whole picture he only looked at the weather aspects of the problem when there was much more to it. ",,,,B 125,"Charlestonês flooding problems are due to the increases in developed land areas with impermeable surfaces. What the meteorologist said was wrong. There wouldnêt be increased precipitation. Precipitation changes very little every year. There are little rivers, ponds, and lakes in Charleston so the clouds have very little water to pick up. If something happened to the ecosystem in Charleston the rain and snow would increase, but there hasnêt. The coverage has decreased in some natural areas and increased in developed-impermeable surfaces. In the developed-permeable surfaces the land coverage has increased only 8 times   What the meteorologist said may¾sound right, but would not be accurate because the buildings, walkways, and parks have increased. There for the water doesnêt have anywhere to go. Then it floods.",2,3,2,2B 126,"Charlestonês flooding problems are due to the increases in developed land areas with impermeable surfaces not the increase in the annual precipitation. The meteorologistês claim is inaccurate for simple reasons that to be quite frank are hard to miss. The meteorologist has blamed the increase in annual precipitation when actually the cause of the problem is the increase in the impermeable surfaces that have been developed. For those that do not know that means the water cannot pass through the surface that has been developed. As the years went by the number of impermeable surfaces has increased. In 1973 there were only 13 impermeable surfaces in Charleston. Then in 2013 it rose to 36 that is a difference of 23 impermeable surfaces. In 1973 there were only 12 permeable surfaces in 2013 there were 19, thatês a difference of 7. So if there are 36 impermeable surfaces and 19 permeable surfaces thatês a difference of 15. Simply put the water has very few surfaces to pass through and a lot that it cannot pass through. If you had increased the amount of permeable surfaces and reduced the impermeable surfaces than you would not have a flooding issue in Charleston. The increase in rain is only a fraction of the problem the majority of the problem is that there are so many impermeable surfaces that the water cannot pass through so it stays in the town with no way to escape but through the very few permeable surfaces that Charleston has built within the past 40 years.",,,,B 127,"The meteorologistês claim is inaccurate because the precipitation patterns in 2005 was not , it the fact that over time more Developed-permeable surfaces has be built causing natural areas to go down. Because of the permeable surfaces when it rain, water gets trapped and as it rains more, more gets trapped causing to flood. The meteorologistês claim is also inaccurate because during to 2005 the precipitation patterns were at its almost at its lowest, 2003 was the lowest it got but increased really slowly over the next 4 maybe 5 years. My claim is that the cause of the Charlestonês flooding problem is the increased of population which led to the increased of Developed-permeable surfaces being built and less and less of natural areas and Developed-impermeable surfaces can be built or remain natural areas, which is causing water to get trap and just sit there and that during that time the precipitation patterns increased from 2003 to 2006, causing more rain to come down and flood the city so easy.  ",2,2,0,3B 128,Charlestonês  flooding problems are due to the increases in developed land areas with impermeable surfaces. The meteorologistês ,,,,B 129,"The reasons for the flooding in Charleston may be because of the precipitation, but if you look at the data Charleston had some heavy rainfall and snow fall in about 1963 and it began to steadily decline in around 1970. Back then as far as I can tell there werenêt that many floods since the area was more covered by natural areas allowing the water to flow over it. The meteorologistês claim is incorrect since the precipitation was about the same amount as back then in 1970. Because of the increase in impermeable areas and the decrease in the natural areas. Precipitation may have had a part in the flooding but the areas where the water cant freely flow through are the cause of the flooding since the developed-Impermiable areas are starting to rise the water keeps getting clogged not allowing enough water to flow through fast enough causes the water to build up bit by bit can cause the flooding.",,,,B 130,"Charleston has done construction work in the year 2005, but they just started doing it in 2005 they didnêt do anything before, and since they had founded the town in 1900 that may be why the town has been flooding. Since they have built all of these new things: parking lots, homes, and many new schools, etc. it may be flooding since the rain cannot get out they are blocking it off somewhere so since the rain cant get out it has to stay in so that would mean that it would increase in the flooding. In 1973 the developed-permeable surfaces flooded 12%, developed-impermiable surfaces flooded 13%, and the natural areas flooded 75%, and as the years went on the flooding increased. The precipitation was really good and helpful in 1963 that took a lot of it way down. For there not t be anymore flooding they will have to build a few flood routes so that the water will be able to get out and they need to build better buildings because that might have been one problem.",,,,B 131,"The meteorologists claim is inaccurate because the Data shows that the natural areas decreased a lot since 19973, the developed permeable surfaces increased a little bit since 1973, then the developed- impermeable surfaces increased significantly since 1973 witch suggests that the Charleston flooding problems are due to the increases in developed land areas with impermeable surfaces. The Meteorologists claim is that – The cause of Charlestonês flooding problem is the increased precipitation. The annual precipitation data shows that rain and snowfall in the area have increased steadily since about 2005 .  Flooding did become a problem until 2005. Therefore, increased has led to local flooding.” The data shows on graph 1 that the rain pattern went everywhere so there could be a possibility of it being both. It could very well be inaccurate as well.",,,,B 132,"The Charlestonês flooding problem was not a big problem until about 2005 and that was because about that time that is when they was built schoolês ,new houseês and sidewalkês . The date shows that it was never a problem . Now it is flooding and the date shows that the house and the sidewalkês donêt let water though and the hole town has moved down. The mud and rock that the town is on is moving down. We all know that water goês down hill so if the town is in a hole. Then yes it is going to flood easy. From 1963 the rain water that they got was 50 inchês the has gone up and all the way from then in 2013 it has went up 10 inchês and that is a lot of rain in 1973 the surface was most of natural areas and vary little man made things. In the years the natural areas are going down and the mad made stuff was going up and that is harting them too because it s taking away the grass and all the things that will suck the water in. It was 75 natural areas and 12 developed permeable but in 2013 it was 45 natural areas and 19 developed permeable and 36 developed impermeable but down in the years it was going down about 3 -5 each time and that is the data form the middle school science class investigating the flooding problem.  I think we need to see if we can make the water go around the town or make ways for it to go though the town without flooding it and that will help the people and the things in the town. ",,,,B 133,"I believe the meteorologist is incorrect. The amount of precipitation is a part of why it floods a lot but also the land is a big part to. Plus if there is a grass land then yes it will flood because the water can get threw the grass. Also, the human population everyone putting in new houses and stuff will cause flooding cause the ground will not be level. Besides when it rains the roads and stuff the water cant get threw the water goes on and on until it finds a not level spot or a grass area and it starts to flood it. Since 1973 Charleston keeps changing the land area coverage. They developed more and more impermeable areas and not a lot of permeable areas. They added a lot of natural areas though. Then they decreased in the natural areas. They got rid of them most likely because of the population had to make more homes for the families that were coming in. Which also means they had to make more permeable areas cause to build more homes you have to build roads to. Charleston didnêt have flooding problems till 2005. Thatês probably because in between the years of 2003 and 2013 was the most precipitation they got. And with all the natural areas they lost by then there wasnêt a lot of places the water could go because of course the water cant get threw the permeable places. And even though there was more impermeable places the water from the permeable places has to find its way to the impermeable places. They need to make less impermeable areas so they can make permeable places so the water cant get threw. Then, there will be less flooding.  Then with more area they can make more money and have a bigger population as well.",,,,B 134,"The increasing amount of flooding in Charleston is caused by the amount of impermeable land that has developed over the years because of the cityês growing population. Meteorologists have argued that the increasing amount of flooding is because of the amount of precipitation over the last years. Yes, since 2005 they have had increasingly more precipitation than before, but this the amount of impermeable land has also increased which has caused flooding.  Meteorologists havenêt mentioned in their statement that the amount of natural areas have decreased because of the building of impermeable areas. The flooding in Charleston is going to get more severe if they keep taking away natural areas to stop some of the flooding. The growing population of Charleston gives a need to create more impermeable area, but at this rate the city of Charleston is going to have to manage away to decrease flooding. More permeable land can decrease the flooding but when they take away natural areas to build streets, sidewalks, and housing areas they are opening themselves up for more flooding. Charlestonês flooding problem is not being caused by the increase of rain it is because of the amount of impermeable land they have developed over the years from their increasing population.",,,,B 135,"Charlestonês flooding problems are due to the increases in in developed land areas with impermeable surfaces, the meteorologists claim that –the cause of Charlestonês flooding problems are due to the increased precipitation.” Is false for a number of reasons. One reason is that the precipitation graph shows that the precipitation amounts are about the same between 1963-1973 are about the same as they were in 2013. The reason for the increases in the flooding isnêt because of the rain fall but instead its because of the decrease in natural areas and the increase in the developed areas the percentage of different surfaces of natural areas have decreased by 30% since 1973, and the developed-permeable surfaces have increased by 7%, the developed impermeable surfaces has increased by 23% and the impermeable surfaces added by humans are what hold the water causing the city to flood more and more every year. The reason the natural areas are important in this case are they soak up the water that gets in the dirt because the plants need water to survive so the dirt absorbs some of the water that way the plantsê roots can suck the water in through the dirt. The reason that is important is so you donêt have all the standing water that has no where to go so it just sits there until it all evaporates which if you have a decent rain the water doesnêt have anywhere to go and it cant evaporate quick enough to make room for the other rain so it just keeps piling up and then it finds way into your house whether it be through a leaking roof because someone didnêt redo the roofing or cracks in your window sill it finds somewhere to go so it starts going there into your floor electronics and anything it can get into all because you didnêt have any dirt to absorb the extra water.  ",,,,B 136,"The city of Charleston has quickly grown in the past 10 years. Charleston has built three new schools, many new homes, expanded existing roads, built more sidewalks and have also made more parking lots. Citizens of Charleston wonder why theyêre town has been flooding so much, the middle school students have wanted to investigate the problem and take it to theyêre local meteorologist to maybe find an answer. The reason why Charleston is flooding so much is because the city has developed-impermeable surfaces which are areas that humans have created with materials that do not allow water to go through like sidewalks, buildings, and roads.  Without all of these objects in the way of the water, Charleston could make more developed-permeable surfaces which is areas that humans have created with materials that allow water to go through like soccer fields covered with grass.",0,3,0,1