Student,Response,Analysis,Explanation,Critique,Advance ClaimE 338,"In the Charlestonês Flooding Problem investigation, the meteorologistês claim was inaccurate  because the meteorologistês claims –The cause of Charlestonês flooding problem was caused by the increase in precipitation”, when actually  Charlestonês flooding problems are due to the increase in developed land areas with impermeable surfaces. In the investigation 2 graphs were created graphing Precipitation patterns in Charleston, and Changes in land Area Coverage in Charleston. Graph 1 (Precipitation patterns in Charleston 1963-2013) lists in 1963 the annual average precipitation (inch) was 50 inches compared to 2013 which was 60 inches, Charlestonês average precipitation had increased by 10 inches. Graph 2 (Changes in land Area Coverage in Charleston) lists Percentage of Different Surfaces, in 1973 Natural Areas were at 75%, Developed-Permeable Surfaces were at 12%, and Developed-Impermeable Surfaces were at 13% compared to in 2013 which lists Natural areas were at 45%, Developed-Permeable Surfaces were at 19%, and Developed-Impermeable Surfaces were at 36%. The Developed-Impermeable Surface percentage had increased by 23% and the Natural Areas had decreased by 30%. Graph 2 clearly proves that Charlestonês flooding problem isnêt caused by precipitation, the flooding was caused by the increase of Developed-Impermeable Surface and the decrease in Natural Areas because there was such an drastic change in the land coverage, it caused the precipitated liquid to get blocked off from open grassland areas and flood the city instead of soaking into the ground like it originally should have. ",3,4,2,4E 339,"Charlestonês flooding problems are due to the increases in developed land areas with impermeable surfaces. Charleston, a city founded in the early 1900ês, has experienced excessive flooding, which can cause property damage. Since this has concerned many of the residents, a local middle school science class collected data for the annual amount of precipitation over the last 50 years, and the percentage of land use such as, developed-impermeable surfaces, developed-permeable surfaces, and natural areas. The results show that annually, there was about 68in. of rain in 1973 and 2013, but only about 33in. in 1983 and 2003. The results also show that as the natural areas decreased over the years, the developed surfaces increased. As the percentage of developed-impermeable surfaces, which doesnêt allow water to seep through, was quickly rising, so were the amount of floods. With 36% developed-impermeable surfaces, this allows less and less rain and snowfall to be soaked into the ground, resulting in flooding. As increased developed-impermeable surfaces, like asphalt, concrete, buildings, and roads, are created, the precipitation will have very few places to soak into. Although, a local meteorologist would like to disagree with this. After seeing the data from the middle school science class, the meteorologist inferred that –The cause of Charlestonês flooding problem is the increased precipitation. The annual precipitation data show that rain and snowfall in the area have increased steadily since about 2005. Flooding did not become a problem for the city until 2005. Therefore, the precipitation has led to local flooding.” The meteorologist is right, the precipitation has increased since 2005, but at about 68in., there is an equal amount of precipitation now, in 2013, as it was in 1973. So, why wouldnêt there be a lot of flooding in 1973? The only answer is that in 1973 there were only 13% developed-impermeable surfaces, giving a way for the precipitation to soak up, but now there are 36% developed-impermeable surfaces, giving fewer spots for the precipitation to soak up. So, to come to conclusion, Charlestonês excessive flooding is due to the increase in developed-impermeable land areas, not because of the amount of rain and snowfall.",4,4,4,4E 340,"Charlestonês flooding problems are due to the increases in developed land with impermeable surfaces. In the second graph the developed- impermeable surfaces grew to almost double its amount from 1973 to 2003, and then doubled again in 2013. Since the word impermeable means water or liquids canêt go through those surfaces. Since the natural areas and developed permeable surfaces decreased over the time period from the graph the city area is not absorbing as much water from the rain. The meteorologist claim (The cause of Charlestonês flooding problem is the increased precipitation.) is inaccurate because in graph one Charlestonês precipitation amount was just as high in1973 as in 2013, but they didnêt have a problem in 1973.  So the reason that in 1973 they didnêt have a problem is that there were more natural areas than developed impermeable surfaces.",3,4,4,4E 341,I think the claim the meteorologistês claim is inaccurate. He/she said that in 2005 the Precipitation increased steadily since about 2005. But she/he was wrong because it wasnêt steady it was more of a bumpy then a nice in steady. Plus in none of the graphs did it say anything about floods. So it must have had to have used his/her background knowledge skills. But then again the tittle of the experiment is Charlestonês flooding problem. So they have the graph for precipitation & area coverage but what they did not show is what year the floods took place.  ,1,1,2,0E 342,"The citizens of Charleston have noticed that the city flood each time it rains heavily. Flooding had never been a problem until 2005. The Charlestonês water system has been created with materials that do not allow water to go through like sidewalks, buildings and roads. Developed-permeable surfaces are areas that humans have created with materials that allow water to go through soccer fields covered with grass. Natural areas are spaces that have not been developed by humans like rain forest areas. The Charlestonês flooding problems are due to the increases in developed lands areas with impermeable surfaces because impermeable surfaces is water that cannot go through like sidewalks, buildings, roads and grass. The water increases because while the floods forming from the rain, also the water seeks though the grass and while the flood forms the grass seeks the water though the dirt and roots. The meteorologistês claim is inaccurate because the city has a lot of houses and sores and all kinds of stuff that when the flooding hits it will destroy the peoples town, houses and stores that for a while they wonêt have nothing to eat or change their clothes because it all got destroyed by the flooding. ",,,,E 343,"–Charlestonês flooding problems are due to the increases in developed land areas with impermeable surfaces.” Graphs have shown that in 1963 they had quite a lot of precipitation and 13 impermeable surfaces and over the years the precipitation has dropped and then around 2004-2005 that changed while we added more and more impermeable surfaces. As we intentionally added more of these surfaces we got more and more floods. I respectfully disagree with the meteorologistês statement –The cause of Charlestonês flooding problem has increased precipitation. The annual precipitation data shows that rain and snowfall in the area has increased steadily since about 2005. Flooding did not become a problem for the city until 2005. Therefore, increased precipitation has led to local flooding.” Mostly, because when they got floods they had gotten less and less precipitation. Lastly, because, flooding was a problem before 2005 if we got more precipitation every year because of flooding then in 1963 flooding would have been a huge problem. My claim will stay the same based on this data from the graphs. On one these graphs it shows not just how much precipitation we had in 1963 up until 2013 but, it shows how over the years it has dropped (less impermeable surfaces) and then increased (because we added more impermeable surfaces). The second graph shows how much of natural lands had dropped (to be able to make more impermeable lands) and permeable surfaces have increased by 2 every 10 years. Impermeable surfaces have increased so much over every 10 years at first from 1973 to 1983 it increased by 2. Then from 1983 to 1993 it increased three. After that it jumped from 1993 to 2003 by three. Last but not least it jumped from 2003 to 2013 by a total of 15. –Charlestonês flooding problems are due to the increases in developed land areas with impermeable surfaces.” (Is my claim and will always be) which is in my opinion the truth while as –The cause of Charlestonês flooding problem has increased precipitation. The annual precipitation data shows that rain and snowfall in the area has increased steadily since about 2005. Flooding did not become a problem for the city until 2005. Therefore, increased precipitation has led to local flooding.” (will always be the meteorologists first claim hopefully based of my information this meteorologist will change his mind.) ",,,,E 344,"In the graphs provided for me, it shows how in Natural areas of Charlestonês town the amount of flooding goes down, but in the Developed-Permeable and Developed-Impermeable surfaces the flooding has gone up. Does this have an effect on what the meteorologists have to say? Yea, it does! If you noticed on the graph it shows how Developed-Impermeable surfaces have increased on amount of flooding since 1973. It still is going up today! Now one meteorologist says, –Flooding did not become a problem in the city until 2005.” This meteorologist claims that flooding wasnêt a problem, and now it is. I disagree. If this meteorologist looked in the past he/she would know that this amount of flooding was creeping up on you all along. The meteorologist also claims that all the flooding is a local problem, not just the townês problem, thatês where I disagree again. It may look as if itês gone local, but it only looks like that because of the amount of land this town has. I believe all the flooding is because of all the land Charlestonês town has and that the local meteorologist is inaccurate. Evidence I have to prove this is, one when Charlestonês town was found it was small, but over time it grew larger and larger, when finally in 1973 flooding began, and in 2005 a terrible flood happened, which got everyoneês attention about the amount of floods they have. Also another reason is how students in a local middle school started collecting data to see how much precipitation has happened over the years. These results are the graph that they provided for me to test this claim. All the evidence helps me support my claim by it tells me when the flooding first happened and what others have to say and how they deal with it. I believe that if the meteorologist has something to say, first check the data you have then say it, also if the citizens are concerned, then take action and do something like build a water system for the water to go too. It works! This is all I have to say about this Scenario! Thank you!!!                                           ",3,2,2,2E 345,"In the article, the meteorologistês claim is inaccurate because it is not just the increase in precipitation that caused the flooding. It was also the developed land areas with impermeable surfaces. For example, on the graph it says that from 1973 to 2013 there was a 23 percent increase in the number of developed impermeable surfaces ( areas that are human made and do not allow water to go through it, an example is a sidewalk or building) and a 30 percent decrease in natural areas ( an area that has not been developed by humans like forests or lakes) and a 7 percent increase in developed permeable surfaces ( areas that humans created with materials that allow the water to go through it like a soccer field or a sponge).  This change caused the water to start sliding down hill towards the city of Charleston. Also, from 1963-2013 there was an 8 percent increase on how much precipitation the city got. This caused the amount of water that slide downhill towards the city to increase. In conclusion; all of this data is what caused the city to start flooding so much.",4,4,4,4E 346,"The meteorologistês claim is inaccurate because they said that Charlestonês problem with flooding is caused by the increase of precipitation since 2005. Well that is inaccurate because the graph provided says that the average fall of precipitation was very high through the years of 1963 and 1973 and after those years the precipitation levels dropped severely. The meteorologist said that flooding became a problem in 2005 when the years of 1963 through 1973 had 50 to 60 inches of rain fall. Flooding had to happen earlier than 2005 because the levels of precipitation were very high. That doesnêt mean that the meteorologist was wrong about the growth of precipitation over the years because like I said after about the year of 1973 the levels in precipitation dropped, but over the past years the levels in precipitation have grown into the levels they were in the years of 1963 through 1973. The correct claim is –Charlestonês flooding problems are due to the increases in developed land areas with impermeable surfaces.” This claim is correct because the second graph that was provided showed the changes in land area coverage in Charleston. This graph showed that the Natural Areas in Charleston since the year of 1973 have dropped slowly over the past years till 2003. Then after 2003 the Natural Areas have dropped drastically till 2013. The Natural Areas are spaces that have not been developed by humans like forest areas.  I think those numbers have dropped because people are cutting down more trees and wood and that leaves more space for water to move in. Also over the years the Developed-Permeable Surfaces have grown slightly over the years, but just that little amount can make a big difference. But over the years the city has been backing up the other systems that have been growing smaller, with them having more Developed-Impermiable Surfaces. Developed-Impermiable Surfaces are areas that humans have created with materials that do not allow water to go through like sidewalks, buildings, and roads. But the city has not grown with that system enough to keep all flooding out. To keep all the flooding out they need to build more of the Developed-Impermiable Surfaces to make sure there city doesnêt have more damage done to them. My evidence supports the claim because I used information about the cityês precipitation levels and land area coverage from two graphs that were provided. The graphs also provided the years that Charleston has had high precipitation levels and developed and un-developed land coverageês. So all the information means that Charlestonês problem is due to the fact that the increases in developed land areas with Impermiable surfaces have caused flooding.",,,,E 347,"The reasons of the flooding could be because of, the changes in the, Natural Areas, but every time it changes, it goes lower. When it does change it doesnêt change that much. It only changes like a few less. I donêt see how the flooding could be because of the areas, or the Developed-Impermeable Surfaces because, the areas have nothing to do about it. To me it looks like they need some dams. If they build some dams, there would be no flooding, and their problem would be solved. The story says, Developed-Impermeable Surfaces is materials that keep the water out, so what they need to do is, make more Developed-Impermeable Surfaces and their problem will be solved. What else would fix their problem is, stop making so much Developed-permeable surfaces because, thatês what allows the water to come in. I think that Natural Areas have nothing to do with it because, thatês just forest, or the woods. Graph number two says that the Natural Areas are going down, so how is flooding happening because the changes in the Natural Areas? Charleston is saying that flooding didnêt start happening until 2005, but thatês when the natural Areas, was the lowest. I think the solution would be, build a dam, or build more, Developed-Impermeable Surfaces.",,,,E 348,The flooding problems are due to the increases in developed land areas with impermeable surfaces. The local meteorologist claim is wrong because the data on graph 2 shows that the natural land is going away and there is more soccer fields than natural land and the developed permeable surfaces have grown more and developed permeable surfaces gain more water thatês why there is a increase in flooding in Charleston precipitation is not the problem of the flooding.,,,,E 349," Charlestonês flooding problems are due to the increase in developed land areas with impermeable surfaces. I think the meteorologist is right because he said the annual precipitation data show that rain and snowfall in the area have increase steadily since about 2005.Flooding had never been a problem for Charleston until about 2005,but the floods have increase in frequency ever since. In 1963 the precipitation patterns in Charleston had went up to 52, then 1983 it went down to 33, back up in 2003 to 33-34, then the precipitation up and 2013 to 60.In graph 2 the changes in land areas coverage in Charleston by the most is Natural Areas. The least is Developed-permeable surfaces and the most, most is Developed-impermeable surface.  Till then it stay down and got heavier ever time it rains. A critique of the meteorologistês argument is inaccurate because it said he said the flooding didnêt come a problem until 2005. The Charleston had notice the city flood each time it rains.",3,2,3,2E 350,"The local meteorologists had said –The cause of Charlestonês flooding problem is the increased precipitation. The annual precipitation data shows that rain and snowfall in the area have increased steadily since about 2005. Flooding did not become a problem for the city until 2005. Therefore, increased precipitation has led to local flooding.” But I believe Charlestonês flooding problems are due to the increases in developed land areas with impermeable surfaces. I believe this because as the developed impermeable surfaces increased so did the precipitation patterns. In 1973 the impermeable surfaces was 13 but the precipitation was around 52. As the impermeable surfaces began to change so did the pattern, the natural areas continued to get lower as the impermeable surfaces continued to get higher. But one day in 2013 the impermeable surfaces was the highest it has ever been and the precipitation was the highest too. Therefore I believe that only the impermeable surfaces had an impact on the precipitation because the precipitation was not at its highest when the natural areas or developed permeable surfaces were high. Also I think my evidence supports the claim –Charlestonês flooding problems are due to the increases in developed land areas with impermeable surfaces,” because I took my observations from both graphs and stated it in my argument. The reason why I believed the meteorologist reasoning is inaccurate is because in both graphs it never stated the precipitation or changes in land covering, in Charleston, in 2005. So that leads me to believe that he guessed. So if the meteorologist guessed thatês not helping us solve the flooding problem in Charleston, which again means his statement was inaccurate.",,,,E 351,"In the city Charleston had a flooding problem in 2005 because of rain and snow. In a local middle school science class, they were investigating the flooding problem. They investigate on a Developed-impermeable surface, a Developed _permeable surface, and Natural areas. In the Developed-impermeable surface, are lands use divide into three categories, in the Developed-permeable surface, humans have created buildings and roads, and in Natural areas are spaces that have not been developed by humans. The local meteorologistsê claim in 2005 the numbers increase until 2013. ",,,,E 352,Charlestonês flood problems are due to increase in developing land areas because in 1973 we only had 13 developed impermeable surfaces but in 2013 we had 36 developed impermeable surfaces which caused the flood because houses and streets is not soaking the water up and thatês causing it to flood. ,,,,E 353,"Charlestonês flooding problems are due to the increases and decreases in developed land areas with impermeable surfaces. The local meteorologistês claim is inaccurate because in the area it hasnêt increased steadily since about 2005. From graph #1 what it shows is how Animal Average Precipitation (inch) changes each year. And in graph #2 what it shows is how the Changes in land Area Coverage in Charleston each year. From the information that I got from the graphs I can tell that precipitation patters and the changes in land area change constantly. It really doesnêt have a pattern to go with or to tell what the next change will be. I diffidently disagree from what the meteorologist says and what its conclusion is because the problem isnêt the precipitation is being increased. There are more changes then just being increased. There are times that it is also being decreased not just increased as I said you will not be able to tell whether is it going to decrease or increase next year because it has a lot of changes. A lot decreasing and a lot of increasing are going on, in Charleston. In graph #1 around 1963 the average is between 50 and 60 which is high, in 1973-1983 the average goes down to be between 30 and 40. In 1993 it kind of goes high a little bit to be between 40 and from 2003-2013 it goes up higher to be by the 60ês. In graph #2 I can tell that it does have a pattern to go with, each year it decreases and in graph #1 you canêt tell if itês going to increase or decrease.",,,,E 354," Graph 2: Based off the fact that there are more natural areas than both developed permeable and impermeable surfaces; the water would have to go somewhere. And seeing that the roots of the trees and all other forms of plant life in Charleston would have to consume Iêd say about 39.5% of the water because the amount of water consumed depends on how old or big the tree or other form of plant life is. Say a 150 year old oak tree its roots would be somewhere to 8-10 feet long and about 1-2 feet thick so it would have a maximum capacity of about 5-10 gallons of water in total because the diameter of the roots would recalibrate and start to curve causing a circular chamber like a spiral staircase. Graph 1: After examining graphês 1 and 2 I see that the decrease in Natural Areas had caused a slight fall then it continuously started to rise and fall until the developed permeable surfaces had risen to be almost equal to the same quantity as the natural areas there was a slight difference in the developed surfaces seeing that the impermeable surfaces had started to cover more and the Natural land coverage had gone down because of the rise of the amount of buildings allowing more impermeable surfaces to be made. The meteorologist is incorrect or inaccurate because he does not know the independent variable for this investigation, every investigation, experiment, etc. Needs to have both an independent and dependent variable for the experiment to be able to actually work, the independent variable would have to be what causes the exceeding amounts of rain so, rain is water that is evaporated condensed and released from storm or rain clouds because the maximum capacity has been reached to where it has to start over again. This is known as the water cycle, the water cycle is how water or rain makes its way from Oceans, Rivers, and Lakes to being steam or mist that heats up like and floats upwards like helium in a balloon. I say that the independent variable is sunlight and the dependent variable is actually the amount of rain that falls every year in Charleston.  A constant variable in this experiment would be the number years passed and if Charleston had actually flooded or not. Iêm saying this because how else would an area like Charleston be able to flood if it didnêt have enough Natural Areas to soak up the rain but enough rooftops of buildings to hold in the rain until it overflows and ends up flooding? The amount of buildings with caved in rooftops would be another variable in this experiment because if there were 30 buildings with a rectangular rooftop of 10x30 in feet then that would allow almost 1000 feet in rain to fall onto the streets and potentially end up flooding the town in just a small amount of time then again it actually depends on the rate that the rain is actually falling at. The temperature would also play a part in the amount of rain because it would depend on the amount of water that was actually evaporated in the amount of time that the sun was in temperatures hot enough to evaporate partial bodies of water to make it actually able to compact enough rain to fill a cloud and make the cloud to be in Charleston. The reason Iêm stating what I think is because Iêm pulling information from what I know from science already and putting it to use and using other resources like the graphs on the paper that show the yearly rate of rain in a span of 10 years it is showing how much rain is actually falling per decade for every time it actually floods Charleston it means there would have been enough rain to potentially fill more than 300 bottles of water and seal it off completely.",2,1,2,0E 355,(no content),,,,