Student,Response,Analysis,Explanation,Critique,Advance ClaimC 216,The claim says that the rain fall increased in 2005 but flooding wouldnêt have started right away if the precipitation just increased. It would take time for the rain fall to increase enough to flood. I think the real cause is the lack of natural area. Since in the past there was so much was so much forest and natural areas thatês where most of the rain would get stopped and absorbed but shown by graph 2 there is a decrease in permeable areas for the water to go so it is going to the only place there is impermeable areas or cities. Yes the rain increase in rain cause some effect but that wouldnêt be the reason why there is flooding because again the more rain fall would just be absorbed if they still more of the permeable areas. So over the all  meteorologist missed some key research before he made his claim.  ,,,,C 217,The city of Charleston has been having a flooding problem for the past few years.  A middle school class did some research on the flooding and decided that the cause of flooding was because of the increase of developed impermeable surfaces in the area. A meteorologist looked at the studentês data and decided the flooding was because of increased precipitation on the area. The meteorologistês theory that the flooding is caused by increased precipitation is incorrect and the studentês theory that the flooding is caused by impermeable surfaces is correct. The meteorologist is incorrect because there was also a high increase of precipitation in 1963 and there were no floods. There were no floods because at that time there were very few impermeable surfaces stopping the water from going into the ground. The studentês theory is correct because from 2005-2013 there were a lot of impermeable surfaces built. 2005 was also the year the flooding started. The flooding in Charleston is caused by the increase of developed impermeable surfaces in the area. The data proves that the meteorologist was wrong and that a bunch of middle school kids are smarter than them. The meteorologist should rethink their life and possibly apply at McDonalds. In conclusion the studentês theory is correct and the flooding is caused by impermeable surfaces in the area.,4,4,4,4C 218,"The cause of Charlestonês flooding problems are directly associated with the increase in development land areas with impermeable surfaces not the precipitation as the meteorologist claims. In 1963 it precipitated more than in 2005. The thing is, in 2005 it flooded but not in 1963. 1963 had more precipitation than in 2005 so the problem is not the rain. It has to be something else. In 2005, the precipitation increased. It had in the past increased but never flooded. The difference in 2005 is the development of land areas with impermeable surfaces. The reason the development of land areas with impermeable surfaces is the cause of the flooding is there is less places the precipitation can go. Over the years, the percentage of space the rain can go has decreased. In 1973 the permeable surfaces were 75%, but by the year 2013, the percentage was 45%. The cause of Charlestonês flooding is because of the increase in impermeable surfaces, and the decrease in permeable surfaces.",4,4,3,4C 219,"I think that this meteorologist is not right. While the precipitation has been rising, it has nothing to do with the recent floods. I honestly think it has to do with the fact that we are making too many impermeable areas. Since water cannot pass through impermeable objects, it has nowhere to go when it rains. This causes buildup of water which can flood the area. If we had more permeable areas, such as the local soccer fields, there would be less flooding because the water would be able to go into the ground. With the large amounts of buildings and streets in the middle of town the water gathers and floods. Another reason that impermeable surfaces are the cause of the flooding is that before, when there were less buildings and more natural/permeable areas, we had no problem with floods because the water was able to move freely.  If you look at the tables shown, you can see that these problems started to rise when there started to be less natural areas. Before, there were no floods because there were not as much impermeable surfaces, and the water was not stuck in the same spot. The claim the meteorologist made about the precipitation rising being the cause, is false. It is merely a coincidence that there has been more precipitation at the same time as these floods. At the same time, more industrial/urban areas were being built, which meant more impermeable surfaces. More impermeable surfaces means more flooding. My evidence supports this because of basic physics. Water canêt pass through certain things so it sits there, and builds up. History also helps, because when there were less industrial areas and more of a natural setting around the town, this problem was non-existent and we had no problem with flooding. Again, I believe that impermeable surfaces are what caused the flooding in town. The floods started around the same time that we built more and more buildings and roads. When there was more nature in the area the problem wasnêt here because the setting allowed water to pass through into another area. The theory about precipitation being the cause of this is false, and the evidence Iêve shown more than proves that I am correct, and that urban and impermeable areas caused these floods.",,,,C 220,Charlestonês flooding problems from look at the information has been increasing by Developed- impermeable surfaces. I think the material that is used for stopping water from going inside the sidewalks and roads are causing the water to build up on over flow to cause the water of flooding. Also by reading the information the water from the rain is only getting built up inside the grass and the grass can only hold so much water that causes the water to overflow. In the 1900ês Charleston only had barley any buildings sidewalks and more to where in 2005 they built a lot more buildings to where they have token up all the extra grass space for the water to be stored. The flooding also got a little bit worse because one day it would rain then the next it wouldnêt. Meteorologist say the rain and snow problem didnêt become a problem until 2005 that shows it gave it amount of time to build up in the right amount of time.       ,,,,C 221,The town of Charleston has grown a lot since the early 1900s. in its time they have built three new schools and many different homes to meet the growing population. But they have found out over the years that when it rains heavily that it floods most of the streets and causes damage to peopleês properties. Now the kids at the local middle school have decided to do some research about it. The first graph that the students made was about the precipitation patterns in Charleston. The graph shows that in 1963 the rain was a high range of about 52 inches over the years the precipitation has gotten bigger and lower. It got as high as 59 inches by 2013.  The graph number two was about the changes in land area coverage in Charleston. In the natural areas it seemed to get are high as 75 in 1973 and get as low as 45 in 2013. The developed-permeable surfaces got as high as21 in 2013 and as low as 12 in 1973. In the Developed-Impermeable surface it got as high as 36 in 2013 and got as low as 132 in 1973. The cause of the flooding problem has increased the precipitation. The flooding did not become a problem until about 2005.,,,,C 222,"Charlestonês flooding problems isnêt due to the amount of precipitation in Charleston. It is due the lack of very few Permeable surfaces. There is a lot of Impermeable surfaces which wonêt let water go through it just holds all the water which is flooding everything. And because of all the Impermeable surfaces in Charleston, the Natural areas percentage keeps dropping every year. And every year the percentage of Impermeable surfaces keeps increasing which is really bad. The local meteorologist claim is inaccurate because on graph 1 the amount of precipitation starts dropping a lot and the Natural areas percentage kept dropping also. So the amount of precipitation doesnêt matter because it will still keep getting a lot of floods. What the problem actually is, is that their needs to be a lot more Permeable surfaces so water can run through and help prevent having so many floods.",,,,C 223,"In Charleston, flooding was never really a problem, well at least not until 2005. Flooding can be very dangerous for many different reasons. Flooding can cause damage homes, buildings, roads, and even take the lives of people. Students from a local middle school have been collecting data about the cityês precipitation over the last 5 decades. Over time as the city has three different surfaces of ground, the different types of surfaces are: Developed-impermeable surfaces, Developed-permeable surfaces, and Natural areas. Some say that the increased use of developed-impermeable has caused an increase on the flooding, but I would beg to differ. ",,,,C 224,"I believe that the increase in flooding rates is due to the new buildings being built around areas that donêt allow water to pass through it and causing it all to move to areas that do allow water to pass through them. So when the areas that allow water to pass through them over flow then the water starts to back track and go towards areas that donêt allow it to pass and then the water starts to over flow. So the increase in rain and snow fall makes it where the water does not have enough time to evaporate and it just keeps building up more and more till it floods. Which will result in water damage in various propertyês and may even cause death in some areas so yes the meteorologist is wrong the increase is due to more rainfall but the more landscape changes that are made are messing up the land and making it harder for water to travel to safer areas so nothing or anybody gets hurt. So if we stop building water stopping buildings we could save us millions on repair damage and save thousands of lives and make more areas that water can pass through so the water does not build up and over flow then lead to a flood. The more things that we build that wonêt let water pass will increase the flood rate very much and will cost schools, business, and many more places a lot of money so to save money we need to build places that allow water to pass through safely (or just slow down on the building of things for a while). The more water thatês builds up will destroy local nature and kill animals and destroy forests so that means that local animal homes will be gone and they could be forced to go more into the city and hurt people for food and if they die off that will mean less food for us as well. So we need to come together and stop building so many buildings ",,,,C 225,"The meteorologist argument does not make very much sense for multiple reasons. In 1973 Charleston had a little less than sixty inches of rain per year. In 2005 they were averaging a little less than forty inches of rain. So the answer is defiantly not because of an increase in precipitation. The amount of rainfall in 2013 is only about an inch or two high then the amount in 1973. He says flooding did not become a problem since 2005 the reason that is, is because the only had 45% natural areas and in 1973 they had 72% natural areas. Charlestonês whole problem is the amount of Natural areas is decreasing and its Developed-Permeable and Developed-Impermeable areas are increasing. In the year of 1973 Charleston was made up of 75% natural areas, 12% Developed-Permeable and 13% Developed-Impermeable. There large percentage of natural areas does a good job of soaking up all the water because of all the trees. Each year the natural areas go down and the developed areas go up. They keep adding buildings and different things that take out the trees and then the water will eventually have to place to go because obviously the streets will not soak up the water and soccer fields do not do a very good job either. By the time we get to the year 2013 there is 45% natural, 19% permeable and 36% impermeable. So if you add 36 and 19 that gets you 55% developed areas and only 36% natural areas. The rain does increase just a little bit by 2013 but the rain is way down in 2005. Charleston needs to start planting some more trees and stop all the development. ",3,2,4,3C 226,"Charlestonês flooding problems have been increasing and local students have been trying to figure out why. The students have been taking data about the past floods and why they have been increasing. A meteorologist went by one day and argued about the flood reasons. –Flooding did not become a problem for the city until 2005. Therefore, increased precipitation has led to a local flooding.” The meteorologist said that the reason why the floodingês increases is because of the rain and snowfall. He said that it increased steadily since 2005. The city has developed permeable surfaces. With permeable surface and the students have collected it and seen that the flooding were less damaging with developed permeable surfaces. The flooding happen larger due to the fact the water has been eroding down the dirt and cement throughout the city. The meteorologist was inaccurate, just because a few more drops of water have occurred doesnêt mean that it can raise the water. Eroding lowers the area downward and thatês when the water goes in more towards the spots that haven eroded and makes it seem that there is higher flooding.  ",2,1,2,0C 227,"In the City of Charleston there have been many of floods since 2005. People have been saying that this is all happening because of the increase in developed land areas with impermeable surfaces. When you look at the graphs in the passage you can see the precipitation improving over the years. I can disagree with them because in the text it says –In time the city has built three new schools, and many homes to meet the needs of its growing population.” The city has also built more sidewalks and more parking lots. People in the city say that it raining a lot and the flooding increasing is bad for the city band can create a bunch of property damage. I disagree with the meteorologist because bringing new buildings, sidewalks and parking lots can be a good thing for your city. Schools can help kids learn more and be able to allow more kid to be able to learn what they need to learn, and get the correct education to grow up and do their dream job .Sidewalks can help the city by making the city safer and keeping young kids, teens, and older adults of the road and save them from getting hit and losing their lives. I can also disagree because having more buildings can have water flow through more and not get stopped up. Floods and snow storms arenêt good things but they arenêt that bad.  ",,,,C 228,"The meteorologistês claim is inaccurate because from 1963 to 1976 you were seeing the same amount of precipitation as you are in 2005 to 2013. The floods arenêt occurring because there is more precipitation involved, they are happening because all of the natural land where the water was going is being replaced with manmade objects. In the 2nd Graph there is evidence to support my claim. These floods are not happening because of more annual precipitation. No, itês because the manmade structures took up 30% of the natural land over the past 40 years. With less space for the water to go it will just build up so much a flood begins. The number of Developed Permeable surfaces went up by a total of 7% of the last 40 years, but thatês not as bad as the amount of developed impermeable surfaces. The percentage of developed impermeable surfaces percentage sky rocketed by a percentage of 23% which took away from your natural land where the water built up in the 60ês. This is what is causing your flooding, not more annual precipitation. With more manmade structures in Charleston there is going to be less natural areas. They take away the open space for the water to go to and replace it with roads. Those roads are going to get covered in water from the flood. If Charleston were to get their 30% of natural land back for that water to soak up into the group instead of having standing water on the surface, there would be no standing water which means no floods. If they were to close some of the roads and make them natural areas again then less flooding would occur but, with every town more and more people want to live outside which makes the people have to make more roads and expand the town.",4,3,4,2C 229,"The Charlestonês flooding problems was not due to the Increase in population. The Flooding increased because of the Developed-impermeable surfaces. On graph 1 it can seem like it is because of the population but that is indeed inaccurate. The first graph shows that with each passing year the precipitin increases but what the graph does not show is that with each year the artificial developed land increases as well. On Graph 2 it shows the percentage of each area coverage in Charleston. In the year 1973 the natural land percent was 75% and the developed land was at 12-13%. Now in the year 1993 the percent for the natural land was at 67%. Then the devolved land was at 15-18% already you can see the decrees in natural land and the increase in the developed land in only just a couple years tops. In 2013 the natural land was at the low of 45% the developed land was at the high of 19-36%. So in 1973, 1983,1993,2003,2013 you can see how much the land has changed. The only thing the population changes is how unnatural the land has become. That is the only thing the population has changed. So the metrologies claim was in accurate because he did not take in account what the population did to the land and only the land. Could have the land cause the flooding absolutely but there is no for sure thing that caused the flooding.",,,,C 230,"The Charleston middle school science class has been collecting data concerning the recent rise in the number of floods over the past few years. The students have found that the amount of rain has increased greatly since about 2004 which was near the time the flooding began, but the amount of rain they are receiving now is about the same amount they received in the 1970s when flooding was not an issue. The students also found through their research, that the amount of permeable ground has reduced greatly since 2003, and the amount of impermeable ground has increased greatly. The local meteorologist, who specializes in weather, took a look at their data and presented to the class his theory, that the cause of the floods is because of the increase of precipitation since 2005 and has nothing to do with the changes in permeable and impermeable ground. While I agree with the meteorologist that the increase in rain is a major part of the reason for the floods, I donêt think it is the main problem. As I said before, the data collected by the students has shown that although the amount of precipitation has increases since 2005, it is no higher now than it was in the 1970s when flooding was not an issue, which is why I believe that the increase in rain is not the root of the problem. The other possibility that the students investigated, was the changes in permeable and impermeable ground. The ground that the water could seep into to below the surface (natural areas and developed permeable areas such as sports fields) made up between 82% and 87% of the townês surfaces before 2003. Since the recent growth of the town much more land has been developed, and only 66% of the townês area is permeable material. While that may not sound like a huge difference in numbers, it makes a big difference when talking about where all the extra water of recent years is supposed to go. Whereas before, the water would simply seep into the soil and be soaked up by the plants living there, or eventually make its way through the ground to a lake or river, none of these are an option when the ground is developed and impermeable. There is nowhere for the water to go except through man-made drainage systems, which are not as effective as natural systems. This is why I believe that the root of the problem is not, as the meteorologist suggested, the increase in rainfall, but the increase in developed impermeable land.",3,4,4,4C 231,"Simply observing the data shown in the graph of precipitation, and disregarding the other which shows the changes in land area coverage, the obvious answer would be that the cause of flooding is the increase in precipitation. When reading the data displayed on the second graph, it is shown that the natural areas, of which would allow water to pass through, have decreased substantially. This replacement of natural areas with developed-impermeable surfaces restricts the passing of water through the surface, underground. With more developed-impermeable surfaces covering the land, water has less opportunity to escape to the earth, and is forced to remain above ground. Therefore, the cause of flooding is not the increase in precipitation, but rather the increase in developed-impermeable surfaces within Charleston.  Looking back to a later date displayed on the graphs, 1973 had a very large amount of precipitation, but it was reported that flooding was not a problem until 2005. Why may that be? To compare, 1973 had roughly the same amount of precipitation as around the 2010-2013 period. The difference in these times lies within the percentage of different surfaces covering the land in Charleston. In 1973 the natural areas of land accounted for 75% of the land in Charleston, whereas in 2013 natural land only accounted for 45%. The natural land is considered undeveloped-impermeable surface. This means it is land that people have not used to develop on and it will easily allow water to soak through. While this decrease in ability of the water to disperse underground is a substantial factor, there is another that contributes just as much. In 1973, the percentage of developed-permeable surfaces was at 13%. That means that 13% of the land had been developed by humans and is an area in which water cannot pass through to the ground. This low percentage nearly tripled by 2013, replacing the lost natural areas, and becoming 36% of the land. With this much of the land not allowing water to pass through, it is forced to remain above ground for a longer period. The meteorologist claimed that the problem of local flooding was caused by the increase in precipitation. This claim does not take into effect that, aside from the increase in precipitation, the natural areas which would have allowed for the water to flow through have been greatly replaced by developed areas that do not allow water to pass through. With a similar precipitation amount in 1973 and 2010-2013, flooding was only reported to be at a high starting in 2005. The only difference in these time periods is the percentage of different surfaces in Charleston. Between these times, the amount of natural land has decreased and been replaced by developed-impermeable surfaces. This means that the land on which water was once able to pass through easily has been replaced by land that water is not able to pass through at all. The precipitation could have effect on the flooding, but the main reason is the lack of opportunity for the water to get from above ground to under. ",4,4,4,4C 232,"The Charlestonês flooding problem is due to a large amount of rain. Itês depends on the land and how it is used.  In the last 50 years they have lost more Natural Areas and developed more Permeable Surfaces and Impermeable Surfaces.  With the land changing so much and the land is also shifting and changing all the time. But with the land changing so much it is hard for the water to go into the ground if there isnêt enough space, and well there isnêt enough space anymore or else the town wouldnêt be flooding. The land makes a different because over time the land degrades and movies and changes due to nature. The permeable surface and the impermeable surface are growing bigger and the natural area getting smaller.  It makes it hard for the grown/land to take in water. So when you get a lot of rain the ground doesnêt have anywhere to put it so the land just floods.  ",,,,